{
  "$schema": "../../../../config/device-gate-evidence.schema.json",
  "schemaVersion": 1,
  "evidenceType": "lyrics-card-final-device-gate",
  "testFixture": true,
  "status": "READY",
  "candidate": {
    "repository": "Qrzzzz/lyrics-card-generator-android",
    "sourceCommit": "1111111111111111111111111111111111111111",
    "candidateRunId": 1001,
    "candidateRunAttempt": 1,
    "candidateArtifactName": "production-candidate-2.0-111111111111",
    "qualityGateRunId": 9001,
    "releaseMetadataSha256": "5e26640063ad648a161936172e7cd3ace54ea4ccadfa6108df437c8b2dac65a9",
    "package": "com.qrzzzz.lyricscard",
    "versionName": "2.0",
    "versionCode": 20000,
    "productionApk": {
      "name": "lyrics-card-generator-android-2.0.apk",
      "bytes": 40,
      "sha256": "9feaa1df58b5c723f7a468d0cfa8c35a31bc355ba825e900cf1553baf64c6789",
      "certificateSha256": "aaaaaaaaaaaaaaaaaaaaaaaaaaaaaaaaaaaaaaaaaaaaaaaaaaaaaaaaaaaaaaaa"
    },
    "productionAab": {
      "name": "lyrics-card-generator-android-2.0.aab",
      "bytes": 40,
      "sha256": "61cb110e6d1b156350e21e891d4caeeb603382fb3289c1f32d981c900ae01bc5",
      "certificateSha256": "aaaaaaaaaaaaaaaaaaaaaaaaaaaaaaaaaaaaaaaaaaaaaaaaaaaaaaaaaaaaaaaa"
    },
    "testApk": {
      "name": "app-production-release-androidTest.apk",
      "bytes": 45,
      "sha256": "9b5ba459805b3a4b8ade14727f3085003417c8ea452f513aae13464f394bdedf",
      "certificateSha256": "aaaaaaaaaaaaaaaaaaaaaaaaaaaaaaaaaaaaaaaaaaaaaaaaaaaaaaaaaaaaaaaa",
      "package": "com.qrzzzz.lyricscard.test",
      "targetPackage": "com.qrzzzz.lyricscard",
      "versionName": "2.0",
      "versionCode": 20000
    }
  },
  "run": {
    "workflowRunId": 2002,
    "workflowRunAttempt": 1,
    "workflowPath": ".github/workflows/capture-device-gate-evidence.yml",
    "workflowEvent": "workflow_dispatch",
    "artifactName": "final-device-evidence-test-fixture",
    "startedAt": "2026-08-24T00:00:00Z",
    "completedAt": "2026-08-24T01:00:00Z",
    "runner": "TEST-FIXTURE-ONLY",
    "authorizationReference": "TEST-FIXTURE-ONLY",
    "stopOnFirstFailure": true
  },
  "environments": [
    {
      "id": "api26",
      "kind": "AVD",
      "apiLevel": 26,
      "androidVersion": "8.0.0",
      "systemImage": "system-images;android-26;google_apis;x86_64",
      "deviceIdSha256": "2222222222222222222222222222222222222222222222222222222222222222",
      "ramMiB": 4096,
      "avdName": "fixture-api26",
      "webView": {
        "package": "com.android.chrome",
        "version": "69.0.0.0"
      },
      "installedArtifacts": {
        "sourceCommit": "1111111111111111111111111111111111111111",
        "package": "com.qrzzzz.lyricscard",
        "versionName": "2.0",
        "versionCode": 20000,
        "productionApkSha256": "9feaa1df58b5c723f7a468d0cfa8c35a31bc355ba825e900cf1553baf64c6789",
        "testApkSha256": "9b5ba459805b3a4b8ade14727f3085003417c8ea452f513aae13464f394bdedf",
        "certificateSha256": "aaaaaaaaaaaaaaaaaaaaaaaaaaaaaaaaaaaaaaaaaaaaaaaaaaaaaaaaaaaaaaaa",
        "testCertificateSha256": "aaaaaaaaaaaaaaaaaaaaaaaaaaaaaaaaaaaaaaaaaaaaaaaaaaaaaaaaaaaaaaaa"
      },
      "buildFingerprint": "fixture/api26/build",
      "isEmulator": true,
      "actualRamMiB": 3840
    },
    {
      "id": "api30",
      "kind": "AVD",
      "apiLevel": 30,
      "androidVersion": "11",
      "systemImage": "system-images;android-30;google_apis_playstore;x86_64",
      "deviceIdSha256": "3333333333333333333333333333333333333333333333333333333333333333",
      "ramMiB": 4096,
      "avdName": "fixture-api30",
      "webView": {
        "package": "com.google.android.webview",
        "version": "83.0.4103.106"
      },
      "installedArtifacts": {
        "sourceCommit": "1111111111111111111111111111111111111111",
        "package": "com.qrzzzz.lyricscard",
        "versionName": "2.0",
        "versionCode": 20000,
        "productionApkSha256": "9feaa1df58b5c723f7a468d0cfa8c35a31bc355ba825e900cf1553baf64c6789",
        "testApkSha256": "9b5ba459805b3a4b8ade14727f3085003417c8ea452f513aae13464f394bdedf",
        "certificateSha256": "aaaaaaaaaaaaaaaaaaaaaaaaaaaaaaaaaaaaaaaaaaaaaaaaaaaaaaaaaaaaaaaa",
        "testCertificateSha256": "aaaaaaaaaaaaaaaaaaaaaaaaaaaaaaaaaaaaaaaaaaaaaaaaaaaaaaaaaaaaaaaa"
      },
      "buildFingerprint": "fixture/api30/build",
      "isEmulator": true,
      "actualRamMiB": 3840
    },
    {
      "id": "api33",
      "kind": "AVD",
      "apiLevel": 33,
      "androidVersion": "13",
      "systemImage": "system-images;android-33;google_apis_playstore;x86_64",
      "deviceIdSha256": "4444444444444444444444444444444444444444444444444444444444444444",
      "ramMiB": 4096,
      "avdName": "fixture-api33",
      "webView": {
        "package": "com.google.android.webview",
        "version": "TEST-FIXTURE"
      },
      "installedArtifacts": {
        "sourceCommit": "1111111111111111111111111111111111111111",
        "package": "com.qrzzzz.lyricscard",
        "versionName": "2.0",
        "versionCode": 20000,
        "productionApkSha256": "9feaa1df58b5c723f7a468d0cfa8c35a31bc355ba825e900cf1553baf64c6789",
        "testApkSha256": "9b5ba459805b3a4b8ade14727f3085003417c8ea452f513aae13464f394bdedf",
        "certificateSha256": "aaaaaaaaaaaaaaaaaaaaaaaaaaaaaaaaaaaaaaaaaaaaaaaaaaaaaaaaaaaaaaaa",
        "testCertificateSha256": "aaaaaaaaaaaaaaaaaaaaaaaaaaaaaaaaaaaaaaaaaaaaaaaaaaaaaaaaaaaaaaaa"
      },
      "buildFingerprint": "fixture/api33/build",
      "isEmulator": true,
      "actualRamMiB": 3840
    },
    {
      "id": "api36",
      "kind": "AVD",
      "apiLevel": 36,
      "androidVersion": "16",
      "systemImage": "system-images;android-36;google_apis_playstore;x86_64",
      "deviceIdSha256": "5555555555555555555555555555555555555555555555555555555555555555",
      "ramMiB": 4096,
      "avdName": "fixture-api36",
      "webView": {
        "package": "com.google.android.webview",
        "version": "TEST-FIXTURE"
      },
      "installedArtifacts": {
        "sourceCommit": "1111111111111111111111111111111111111111",
        "package": "com.qrzzzz.lyricscard",
        "versionName": "2.0",
        "versionCode": 20000,
        "productionApkSha256": "9feaa1df58b5c723f7a468d0cfa8c35a31bc355ba825e900cf1553baf64c6789",
        "testApkSha256": "9b5ba459805b3a4b8ade14727f3085003417c8ea452f513aae13464f394bdedf",
        "certificateSha256": "aaaaaaaaaaaaaaaaaaaaaaaaaaaaaaaaaaaaaaaaaaaaaaaaaaaaaaaaaaaaaaaa",
        "testCertificateSha256": "aaaaaaaaaaaaaaaaaaaaaaaaaaaaaaaaaaaaaaaaaaaaaaaaaaaaaaaaaaaaaaaa"
      },
      "buildFingerprint": "fixture/api36/build",
      "isEmulator": true,
      "actualRamMiB": 3840
    },
    {
      "id": "physical",
      "kind": "PHYSICAL",
      "apiLevel": 36,
      "androidVersion": "16",
      "systemImage": "manufacturer/device/build-fingerprint-test-fixture",
      "deviceIdSha256": "6666666666666666666666666666666666666666666666666666666666666666",
      "ramMiB": 8192,
      "manufacturer": "TEST-FIXTURE",
      "model": "TEST-FIXTURE",
      "securityPatch": "2026-08-01",
      "authorizationReference": "TEST-FIXTURE-ONLY",
      "webView": {
        "package": "com.google.android.webview",
        "version": "TEST-FIXTURE"
      },
      "installedArtifacts": {
        "sourceCommit": "1111111111111111111111111111111111111111",
        "package": "com.qrzzzz.lyricscard",
        "versionName": "2.0",
        "versionCode": 20000,
        "productionApkSha256": "9feaa1df58b5c723f7a468d0cfa8c35a31bc355ba825e900cf1553baf64c6789",
        "testApkSha256": "9b5ba459805b3a4b8ade14727f3085003417c8ea452f513aae13464f394bdedf",
        "certificateSha256": "aaaaaaaaaaaaaaaaaaaaaaaaaaaaaaaaaaaaaaaaaaaaaaaaaaaaaaaaaaaaaaaa",
        "testCertificateSha256": "aaaaaaaaaaaaaaaaaaaaaaaaaaaaaaaaaaaaaaaaaaaaaaaaaaaaaaaaaaaaaaaa"
      },
      "buildFingerprint": "fixture/physical/build",
      "isEmulator": false,
      "actualRamMiB": 8192
    }
  ],
  "gates": [
    {
      "id": "api26-core",
      "environmentId": "api26",
      "status": "PASS",
      "attempts": 1,
      "testSelector": "AvdMatrixSmokeTest",
      "startedAt": "2026-08-24T00:00:00Z",
      "completedAt": "2026-08-24T00:01:00Z",
      "logs": [
        {
          "kind": "instrumentation",
          "path": "logs/instrumentation.log",
          "sha256": "e2dbbfc8d8ca72fe11b652032e373b5439cd1e847678d5c8f3285df740a8d6a1"
        },
        {
          "kind": "logcat",
          "path": "logs/logcat.txt",
          "sha256": "1f08d65fed760cdd6e50f32108db4b4120ed1f5051c5277f02aaeb156d0d1fbe"
        }
      ]
    },
    {
      "id": "api26-renderer-webview",
      "environmentId": "api26",
      "status": "PASS",
      "attempts": 1,
      "testSelector": "RendererControllerLifecycleTest",
      "startedAt": "2026-08-24T00:01:00Z",
      "completedAt": "2026-08-24T00:02:00Z",
      "logs": [
        {
          "kind": "instrumentation",
          "path": "logs/instrumentation.log",
          "sha256": "e2dbbfc8d8ca72fe11b652032e373b5439cd1e847678d5c8f3285df740a8d6a1"
        },
        {
          "kind": "logcat",
          "path": "logs/logcat.txt",
          "sha256": "1f08d65fed760cdd6e50f32108db4b4120ed1f5051c5277f02aaeb156d0d1fbe"
        }
      ]
    },
    {
      "id": "api26-recovery-atf",
      "environmentId": "api26",
      "status": "PASS",
      "attempts": 1,
      "testSelector": "ArchitectureRestorationTest+AccessibilityFrameworkTest",
      "startedAt": "2026-08-24T00:02:00Z",
      "completedAt": "2026-08-24T00:03:00Z",
      "logs": [
        {
          "kind": "instrumentation",
          "path": "logs/instrumentation.log",
          "sha256": "e2dbbfc8d8ca72fe11b652032e373b5439cd1e847678d5c8f3285df740a8d6a1"
        },
        {
          "kind": "logcat",
          "path": "logs/logcat.txt",
          "sha256": "1f08d65fed760cdd6e50f32108db4b4120ed1f5051c5277f02aaeb156d0d1fbe"
        }
      ]
    },
    {